{
  "$schema": "https://json-schema.org/draft/2020-12/schema",
  "$id": "https://raw.githubusercontent.com/AIAllTheThingz/Public-Access-Agents/main/schemas/v1/exception-record.schema.json",
  "title": "Standards Exception",
  "description": "Records a time-bounded deviation from a specific rule, including ownership, rationale, risk, compensating controls, approval, status, and closure.",
  "type": "object",
  "additionalProperties": false,
  "required": [
    "id",
    "ruleId",
    "owner",
    "reason",
    "risk",
    "compensatingControls",
    "expiresOn",
    "status"
  ],
  "properties": {
    "id": {
      "type": "string",
      "minLength": 1
    },
    "ruleId": {
      "type": "string",
      "minLength": 1
    },
    "owner": {
      "type": "string",
      "minLength": 1
    },
    "reason": {
      "type": "string",
      "minLength": 1
    },
    "risk": {
      "type": "string",
      "minLength": 1,
      "description": "Human-readable risk statement retained for backward compatibility."
    },
    "riskLevel": {
      "enum": [
        "low",
        "moderate",
        "high",
        "critical"
      ],
      "description": "Optional normalized risk classification."
    },
    "compensatingControls": {
      "type": "array",
      "items": {
        "type": "string",
        "minLength": 1
      },
      "minItems": 1,
      "uniqueItems": true
    },
    "expiresOn": {
      "type": "string",
      "format": "date"
    },
    "status": {
      "enum": [
        "requested",
        "approved",
        "rejected",
        "expired",
        "closed"
      ]
    },
    "approver": {
      "type": "string",
      "minLength": 1
    },
    "approvedOn": {
      "type": "string",
      "format": "date"
    },
    "reviewOn": {
      "type": "string",
      "format": "date"
    },
    "remediationPlan": {
      "type": "string",
      "minLength": 1
    },
    "closureEvidence": {
      "type": "string",
      "minLength": 1
    },
    "schemaVersion": {
      "type": "string",
      "const": "1.0.0",
      "description": "Optional explicit instance contract version. Omitted legacy instances are interpreted as version 1.0.0."
    },
    "extensions": {
      "type": "object",
      "description": "Namespaced extension data. Extension keys must be organization- or product-specific and must not redefine standard fields.",
      "propertyNames": {
        "pattern": "^[A-Za-z][A-Za-z0-9_.-]{1,127}$"
      },
      "additionalProperties": true
    }
  },
  "x-schemaVersion": "1.0.0"
}
